name,title,quote,date,context
"("" Vous avez détruit la beauté du monde! "") - Huguette Gaulin",Canadian Novelist,You have destroyed the beauty of the world!,"June 6, 1972",who committed suicide by burning herself
Adrian McGill,Glasgow Fire Service Sub Officer,I have got that woman. We are all right.,18 November 1972,shouting to other firefighters from the top floor of a burning building. The woman whom McGill died trying to save also died
Lyndon B. Johnson,president of the United States,Send Mike immediately.,22 January 1973,"referring to his Secret Service agent. By the time Mike arrived, Johnson had already died"
Noël Coward,"English playwright, composer and performer",Good night my darlings. I'll see you tomorrow.,26 March 1973,"to Graham Payn, his life partner, and Cole Lesley, his secretary, while going to bed the night before he died"
Pablo Picasso,Spanish artist,"Drink to me, drink to my health. You know I can't drink anymore.",8 April 1973,
J. R. R. Tolkien,English writer and academic,"It is stuffy, sticky, and rainy here at present – but forecasts are more favourable.",2 September 1973,postscript of letter to his daughter Priscilla
"(""Estas son mis últimas palabras y tengo la certeza de que mi sacrificio no será en vano","tengo la certeza de que, por lo menos, será una lección moral que castigará la felonía, la cobardía y la traición."") — Salvador Allende Gossens, Marxist President of Chile","These are my last words, and I am certain that my sacrifice will not be in vain. I am certain that, at the very least, it will be a moral lesson that will punish felony, cowardice and treason.",11 September 1973,addressing the nation during the 1973 Chilean coup d'état moments before killing himself
Jim Croce,American folk and rock singer-songwriter,"Remember, it’s the first 60 years that count and I’ve got 30 to go. I love you.",20 September 1973,in a letter written to his wife Ingrid shortly before he boarded a plane that killed him
Murray Hudson,", New Zealand infantry sergeant","Throw it, just throw it.",13 February 1974,"to a soldier who froze with an armed grenade; the grenade exploded as Hudson tried to release it, killing both men"
George Kelly,American playwright and actor,"My dear, before you kiss me goodbye, fix your hair. It's a mess.",18 June 1974,to one of his nieces
Christine Chubbuck,American news anchor for WWSB (formerly known as WXLT),"In keeping with the WXLT practice of presenting the most immediate and complete reports of local blood-and-guts news, TV-40 presents what is believed to be a television first — in living color, exclusive coverage of an attempted suicide.",15 July 1974,just before shooting herself in the head on air
"(""Джинсы бы не испачкать..."") — Anatoli Kozhemyakin",Soviet footballer,I don't want my jeans to get dirty...,13 October 1974,"trying to exit a stuck elevator before it began moving, crushing him to death"
Walter A. Zadra,first officer of Northwest Orient Airlines Flight 6231,"Pull now ... pull, that's it.",1 December 1974,before plane crashed in Harriman State Park (New York)
Josephine Baker,French-American dancer and singer,"Oh, you young people act like old men. You are no fun.",12 April 1975,
Rod Serling,American screenwriter,You can't kill this tough Jew.,28 June 1975,note written from hospital bed to colleague Owen Comora
Vaughn Bodē,American cartoonist and illustrator,"Mark, I've seen God four times, and I'm going to see him again soon. That's No. 1 to me, and you're No. 2.",18 July 1975,to his son
Ernest M. McSorley,Canadian sailor and captain of SS Edmund Fitzgerald,We are holding our own.,10 November 1975,last transmission before ship went down in storm on Lake Superior
Werner Heisenberg,German theoretical physicist,"When I meet God, I am going to ask him two questions: Why relativity? And why turbulence? I really believe he will have an answer for the first.",1 February 1976,
Sal Mineo,American actor,Oh God! No! Help! Someone help!,12 February 1976,while being murdered
"(""我很难受，叫医生来。"") — Mao Zedong",Chinese statesman and revolutionary,I feel ill. Call the doctors.,9 September 1976,
Gary Gilmore,American criminal,Let's do it!,17 January 1977,prior to execution by firing squad
Freddie Prinze,American stand-up comedian and actor,I must end it. There's no hope left. I'll be at peace. No one had anything to do with this. My decision totally.,29 January 1977,"as his suicide note, before shooting himself in the head"
Edith Ewing Bouvier Beale,American socialite,There's nothing more to say. It's all in the film.,5 February 1977,"to her daughter, Edith Bouvier Beale, referring to the documentary Grey Gardens"
Jacob Veldhuyzen van Zanten,pilot of KLM Flight 4805,Oh yes.,27 March 1977,shortly before colliding with Pan Am Flight  1736
Robert Nairac ,British Army intelligence officer,"Bless me, Father, for I have sinned.",15 May 1977,"abducted and shot to death by the Provisional Irish Republican Army. His last words were addressed to one of his abductors, who posed as a priest in an attempt to gain information through Nairac's confession"
Vladimir Nabokov,Russian-American author and entomologist,A certain butterfly is already on the wing.,2 July 1977,; he had a keen interest in butterflies
Francis Gary Powers,American pilot,TV four just lost -,1 August 1977,last radio transmission before a helicopter crash killed him and cameraman George Spears
Elvis Presley,American musician,I'm going to the bathroom to read.,16 August 1977,shortly before being found dead on the bathroom floor
Groucho Marx,American actor and comedian,This is no way to live!,19 August 1977,
MacKinlay Kantor,American author,Horrible. Horrible!,11 October 1977,"to his grandson, Tom Shroder"
Bing Crosby,American singer and actor,"That was a great game of golf, fellas. Let's go have a Coca-Cola.",14 October 1977,moments before collapsing and dying of a heart attack
Charlie Chaplin,English actor and filmmaker,"Why not? After all, it belongs to him.",25 December 1977,"to a priest who had said, ""May the Lord have mercy on your soul"""
Terry Kath,American lead singer and guitarist for Chicago,What do you think I'm gonna do? Blow my brains out?,23 January 1978,before accidentally shooting himself
Eddie Aikau,American lifeguard and surfer,"Don't worry, I can do it. I can get to land.",17 March 1978,leaving voyaging canoe Hōkūleʻa after it began leaking to paddle to shore for help. The rest of the canoe's crew were rescued
Keith Moon,English drummer for the rock band the Who,"If you don't like it, you can fuck off!",7 September 1978,to his girlfriend Annette Walter-Lax
Captain James McFeron,pilot of Pacific Southwest Airlines Flight 182,"This is it, baby! Brace yourself.",25 September 1978,as the Boeing 727 crashed after colliding with a Cessna 172 over San Diego
Frederick Valentich,Australian aviator,It is hovering and it's not an aircraft.,21 October 1978,last transmission before disappearing after possibly sighting a UFO
Tony Prangley,British commercial diver,All stop.,26 November 1978,"prior to anchor chain severing diving bell connections to MS Star Canopus, causing bell containing Prangley and fellow diver Michael Ward to plummet to the sea floor"
Conrad Hilton,American hotelier,Leave the shower curtain on the inside of the tub.,3 January 1979,on being asked if he had any final words of wisdom
Jack Soo,American actor,It must have been the coffee.,11 January 1979,"; speaking to Hal Linden while being wheeled into operating room, referring to the bad coffee Soo's character made on their sitcom Barney Miller"
Zulfikar Ali Bhutto,President and Prime Minister of Pakistan,"God help me [Allah madad], for I am innocent.",4 April 1979,prior to execution by hanging
Amir-Abbas Hoveyda,Prime Minister of Iran,It wasn't supposed to end like this.,7 April 1979,during execution after the Iranian Revolution
John Spenkelink,American convicted murderer,Capital punishment; them without the capital get the punishment.,25 May 1979,prior to execution by electrocution
first officer of American Airlines Flight 191 (25 May 1979); last word heard before CVR cut off.,,Damn!,25 May 1979,; last word heard before CVR cut off
John Wayne,American actor,Of course I know who you are. You're my girl. I love you.,11 June 1979,"to his daughter, Aissa Wayne, who had asked if he knew who she was"
Thurman Munson,American baseball player,Are you guys okay?,2 August 1979,"trapped in crashed plane, to his two passengers, who survived"
Louis Mountbatten,"1st Earl Mountbatten of Burma, British Royal Navy officer and statesman",Do you really think the IRA would think me a worthwhile target?,27 August 1979,prior to death in IRA bombing of his fishing boat
Park Chung Hee,3rd President of South Korea,"Yes, I am fine...",26 October 1979,"in response to Cha Ji Cheol and a woman next to him asking if he was all right after being shot by Kim Jae-gyu, prior to being fatally shot in the head"
Captain Charles Gilbert (31 October 1979),,"Oh, Jesus Christ!",31 October 1979,"pilot of Western Airlines Flight 2605, before the plane crashed into a hangar. His last words were captured on a black box.""May God have mercy on the assassins."" — Óscar Romero, Salvadoran Roman Catholic prelate (24 March 1980), assassinated while giving a sermon"
Jean-Paul Sartre,French philosopher and writer,"I love you very much, my dear Beaver.",15 April 1980,"to his partner, Simone de Beauvoir"
"(""Lorsque vous avez été pendant de nombreuses anées en montagne","vous pouvez finir par oublier que ce n'est pas un monde pour l'homme. Chaque jour, je dois me souvenir que ce n'est pas un monde pour l'homme. C'est la seule façon sûre de l'aborder. Sinon c'est comme quand un boxeur baisse sa garde, ça peut s'arrêter très vite."") — Nicolas Jaeger, French physician and alpinist","When you've been in the mountains for many years, you may forget that it's not a man's world. Every day I have to remember that this is not a world for man. This is the only sure way to approach it. Otherwise it's like when a boxer lets his guard down, it can stop very quickly.",27 April 1980,prior to disappearing on Lhotse Shar in Nepal
Alfred Hitchcock ,English filmmaker,"One never knows the ending. One has to die to know exactly what happens after death, although Catholics have their hopes.",29 April 1980,
David A. Johnston,American volcanologist,Vancouver! Vancouver! This is it!,18 May 1980,reporting the 1980 eruption of Mount St. Helens from observation post
Ian Curtis,English musician,"At this very moment, I wish I were dead. I just can’t cope anymore.",18 May 1980,written on a note before hanging himself
Tex Avery,American animator,"I don't know where animators go when they die, but I guess there must be a lot of them. They could probably use a good director though.",26 August 1980,"to an animator while watching a baseball game, according to Chuck Jones"
Darby Crash,American musician,"My life, my leather, my love goes to Bosco.",7 December 1980,"writing a note to his friend David ""Bosco"" Davenport while dying of a heroin overdose"
John Lennon,English musician,I'm shot! I'm shot!,8 December 1980,moments after being fatally shot
Ben Travers,English writer,This is where the real fun starts.,18 December 1980,
Steven Judy,American convicted murderer,I don't hold any grudges. This is my doing. Sorry it happened.,9 March 1981,prior to execution by electrocution
Bobby Sands,Provisional Irish Republican Army volunteer and British Member of Parliament,The day will dawn when all the people will have the desire for freedom ... And it's then that we'll see the rising of the moon.,5 May 1981,final diary entry during hunger strike
Bob Marley,Jamaican musician,Money can't buy life.,11 May 1981,
William Saroyan,American author,It's the most beautiful time in my life – and death.,18 May 1981,
Alfredo Rampi,Italian child,Mama!,13 June 1981,moments before he died after falling in a well
Frank McAteer,"La Plata County, Colorado sergeant","You know, it's people like you who put peace officers in hospitals or drive them to Pueblo.",4 July 1981,to suspect who resisted arrest; McAteer then collapsed from a heart attack
Natalie Wood,American actress,"Help me, someone please help me, I'm drowning.",29 November 1981,crying for help from drowning
John Belushi,American actor and comedian,Just don't leave me alone.,5 March 1982,before dying of drug overdose
Robert Armitage,", Royal Navy officer",I can't face it anymore.,26 May 1982,prior to shooting and slightly wounding his wife and then killing himself
Vincent Chin,Chinese-American draftsman,It's not fair.,19 June 1982,just after being beaten with a baseball bat by Chrysler plant supervisor Ronald Ebens. Chin died four days later at Henry Ford Hospital
Vic Morrow,American actor,I've got to be crazy to do this shot. I should've asked for a double.,23 July 1982,prior to being killed along with two child actors during filming in the Twilight Zone accident
Sobhuza II,"King of Swaziland, longest verifiably-reigning monarch in recorded history",I am going.,21 August 1982,to his minister of health after halting a meeting
Ingrid Bergman,Swedish actress,Do I look all right? Give me my brush and my makeup.,29 August 1982,on hearing she had a visitor
Lester Roloff,American fundamentalist Independent Baptist preacher and founder of teen homes,I believe this is going to be the greatest day of my life!,2 November 1982,prior to fatal plane crash
Captain William S. Todd (11 January 1983),,Running out of air.,11 January 1983,"pilot of United Airlines Flight 2885, just before the plane crashed after takeoff from Detroit Metropolitan Airport"
Hergé,Belgian cartoonist,I love you.,3 March 1983,
Ken Carter,Canadian stunt driver,"Everything is fine, I'm ready to go.",5 September 1983,prior to fatal pond jump in rocket-powered car
John Le Mesurier,English actor,It's all been rather lovely.,15 November 1983,
John Eldon Smith,American convicted murderer,"Well, the Lord is going to get another one.",15 December 1983,prior to execution by electrocution
"(""Tue-moi si tu veux mais arrête de m'emmerder"") — Paul Gégauff",French director,"Kill me if you want, but stop bothering me!",24 December 1983,before being killed by his Norwegian wife
Ronald Clark O'Bryan,American optician who killed his son with poisoned Halloween candy for life insurance money,"What is about to transpire in a few moments is wrong! However, we as human beings do make mistakes and errors. This execution is one of those wrongs yet doesn't mean our whole system of justice is wrong. Therefore, I would forgive all who have taken part in any way in my death. Also, to anyone I have offended in any way during my 39 years, I pray and ask your forgiveness, just as I forgive anyone who offended me in any way. And I pray and ask God's forgiveness for all of us respectively as human beings. To my loved ones, I extend my undying love. To those close to me, know in your hearts I love you one and all. God bless you all and may God's best blessings be always yours. Ronald C. O'Bryan. P.S. During my time here, I have been treated well by all T.D.C. personnel.",31 March 1984,prior to execution by lethal injection
Marvin Gaye,American singer,"Mother, I'm going to get my things and get out of this house. Father hates me and I'm never coming back.",1 April 1984,moments before being shot to death by his father
Tommy Cooper,Welsh magician and comedian,"Thank you, love.",15 April 1984,"to his assistant before collapsing due to a heart attack in front of a television audience of 12 million. The assistant smiled and the audience laughed, mistakenly believing it was part of the act"
Robert M. Bond,United States Air Force lieutenant general,"I've got to get out, I'm out of control.",26 April 1984,prior to failed ejection from Mikoyan-Gurevich MiG-23 jet fighter-bomber
Truman Capote,American author,Mama— Mama— Mama.,25 August 1984,He had been separated from his mother for several years during his childhood
Jon-Erik Hexum,American actor and model,Can you believe this crap?,18 October 1984,prior to dying by accidental self-inflicted blank cartridge gunshot to the head
Indira Gandhi,Indian politician and stateswoman,Namaste...,31 October 1984,prior to her assassination
Velma Barfield,American serial killer,"I know that everybody has gone through a lot of pain, all the families connected, and I am sorry, and I want to thank everybody who have been supporting me all these six years.",2 November 1984,right before her execution
Roosevelt Green,"Jr., American convicted murderer","I am about to die for a murder that I did not commit, that someone else committed ... I love the Lord and hope that God takes me into his kingdom, and goodbye, mother.",9 January 1985,prior to execution by electrocution
Karel Soucek,Czech-Canadian stuntman,I'm ready. It feels good. It's a go.,20 January 1985,prior to fatal barrel drop from ceiling of Houston Astrodome
James Beard,American chef and cookbook author,I can't anymore.,23 January 1985,no longer able to speak
"Rudolph Przydzial ""Rudy"" Price Jr. (2 August 1985)",,Shit!,2 August 1985,"First Officer of Delta Air Lines Flight 191, reacting to the first impact of the Lockheed L-1011-385-1 TriStar"
"(""ああ、おわった"") — Captain Masami Takahama (12 August 1985)",,It's... the end!,12 August 1985,"pilot of Japan Air Lines Flight 123, just before the Boeing 747 crashed into a mountain"
Art Scholl,American aerobatic pilot,"I have a problem, I have a real problem.",16 September 1985,after his plane entered a flat inverted spin during filming of Top Gun
Rock Hudson,American actor,"No, I don't believe so.",2 October 1985,when asked if he wanted a cup of coffee
Philip Larkin,English poet and novelist,I am going to the inevitable.,2 December 1985,to his nurse
Phil Lynott,"Irish singer, musician and songwriter","I'm bad, I'm nineteen.",4 January 1986,dying at age 36
Michael J. Smith,American astronaut,Uh oh.,28 January 1986,prior to the disintegration of Space Shuttle Challenger one minute and thirteen seconds after liftoff
Benny Goodman,American clarinetist,Don't worry. It's all right.,13 June 1986,"to his friend Carol Smith, who discovered him pale and slumped on his couch after suffering an apparent heart attack"
Jerome Bowden,American convicted murderer,"My name is Jerome Bowden, and I would just like to state that my execution is about to be carried out. And I would like to thank the people at this institution for taking such good care of me in the way that they did. And I hope that by my execution being carried out, that it may bring some light to this thing that is wrong. And I would like to have a final prayer with Chaplain Lizzel if that is possible. Thank you very much.",24 June 1986,prior to execution by electrocution
John William Rook,American convicted murderer,"Freedom. Freedom at last, man. It's been a real good one.",19 September 1986,prior to execution by lethal injection
Jerry Smith,American professional football player who was a tight end for the National Football League,"Every important thing a man searches for in his life, I found in Coach Lombardi. He made us men.",15 October 1986,dying of AIDS
Jane Dornacker,American rock musician and traffic reporter,Hit the water! Hit the water! Hit the water!,22 October 1986,prior to fatal crash of WNBC Radio helicopter into Hudson River
Cary Grant,English-American actor,I love you Barbara...don't worry.,29 November 1986,to his wife while being wheeled to intensive care following a stroke
Desi Arnaz,"Cuban-American bandleader, actor and film and television producer","I love you too, honey. Good luck with your show.",2 December 1986,"over the phone to his former wife, Lucille Ball ″I have nothing to say. (""저는 할 말이 없습니다"") — Park Jong-chul, student activist (14 January 1987), to the police of the Anti-communist Detached Office, who tortured him by water cure, to force him to confess the whereabouts of one of his fellow activists"
R. Budd Dwyer,American politician,"Don't, don't, don't, this will hurt someone!",22 January 1987,to the reporters who tried to stop him from shooting himself on live television
Buddy Rich,American jazz drummer and bandleader,"Yeah, country music.",2 April 1987,"to a nurse who asked him, ""Is there anything you can't take?"" He then died during surgery"
Andy Warhol,American pop artist,I sure hope Salvador is doing alright!,22 February 1987,when notified that Salvador Dalí had been suffering from a mental breakdown
"(""La vie m'est insupportable. Pardonnez moi"") — Dalida",Italian-French singer and actress,Life is unbearable for me. Forgive me,3 May 1987,; writing her suicide note
Edward Earl Johnson,American convicted murderer,I guess no one's going to call.,20 May 1987,prior to execution by gas chamber
Jimmy L. Glass,American convicted murderer,"Yeah, I think I'd rather be fishing.",12 June 1987,prior to execution by electrocution
Jackie Gleason,"American actor, comedian, writer, composer, and conductor",I always knew what I was doing.,24 June 1987,
James Baldwin,American author and activist,I'm bored.,1 December 1987,
Pete Maravich,American basketball player,I feel great.,5 January 1988,before dying of undiagnosed heart defect during pickup game
Heather O'Rourke,American child actress,I love you.,1 February 1988,"to her mother, shortly before dying of septic shock"
Richard Feynman,American theoretical physicist and raconteur,I'd hate to die twice. It's so boring.,15 February 1988,
Kenneth Williams,British actor and comedian,"Oh, what's the bloody point?",15 April 1988,the last words he wrote in his diary
Arthur Gary Bishop,American convicted sex offender and serial killer,I want to offer again my most profound and heartfelt apologies to my victims' families. I am truly sorry. I have tried my best to empathize with their grief and devastation and I hope they come to know of my concerns and prayers for them.,10 June 1988,prior to execution by lethal injection
John Carradine,American actor,"Oh, to die in Italy!",27 November 1988,"dying in Milan, Italy"
Oliver L. Austin,American ornithologist,I think I'll go now.,31 December 1988,"to his wife ″I believe that the image of walking through, these turbulent times live on people's hearts for a long time. (""激動の時代を踏まえた御姿は永く、人々の胸に生き続けると存じます。"") — Emperor Hirohito of Japan, (7 January 1989), a last message to Shoichi Fujimori, commissioner of Imperial Household Agency"
"(""Dónde está mi reloj?"") — Salvador Dalí",Spanish surrealist painter,Where is my clock?,23 January 1989,
Ted Bundy,American serial killer,Give my love to my family and friends.,24 January 1989,prior to execution by electrocution
"(""お願いです、働かせてください！"") — Osamu Tezuka",Japanese cartoonist,"I'm begging you, let me work!",9 February 1989,to a nurse who tried to take away his drawing equipment
Edward Abbey,"American author, essayist and environmental advocate",I did what I could.,14 March 1989,
Abbie Hoffman,American political and social activist,"It's too late. We can't win, they've gotten too powerful.",12 April 1989,in note written prior to phenobarbital overdose
Lucille Ball,"American actress, television producer and studio executive",My Florida water.,26 April 1989,when asked if she wanted anything
Aubrey Dennis Adams,"Jr., American convicted child murderer",I hope and pray that all the new and reopened wounds will be healed quickly after my passing. My death is the Lord's will and I am now with my Lord and Savior Jesus Christ in Heaven.,4 May 1989,prior to execution by electrocution
Gilda Radner,American actress and comedian,Help me out of here. I’ve got to get out of here.,20 May 1989,to her husband Gene Wilder before she went into a coma
Mel Blanc,American voice actor and radio personality,"I love you, Noel.",10 July 1989,spoken in the voice of Yosemite Sam to his son Noel
Laurence Olivier,English actor and director,"This isn't Hamlet, you know, it's not meant to go into the bloody ear.",11 July 1989,to a nurse when she spilled water on him while moistening his lips
Rebecca Schaeffer,American actress and model,Why? Why?,18 July 1989,after being shot at her apartment doorsteps by stalker Robert John Bardo
R. D. Laing (23 August 1989),,No bloody doctors.,23 August 1989,Scottish psychiatrist
Graham Chapman,"English comedian, writer, actor, and author",Sorry for saying fuck.,4 October 1989,to a nurse who stuck a needle in his arm
Bette Davis,American actress,I'm so tired.,6 October 1989,spoken to a nurse before she died
Marc Lépine,Canadian perpetrator of the École Polytechnique massacre,"Ah, shit.",6 December 1989,"in which he killed fourteen women, before fatally shooting himself"
(„Trăiască Republica Socialistă România,"independentă și liberă"".) — Nicolae Ceaușescu, Romanian communist politician, dictator and president of the Romanian Communist Party from 1965 to 1989","Long Live the Socialist Republic of Romania, independent and free.",25 December 1989,"executed by firing squad""I don't want to lay down."" — Hank Gathers, American basketball player (4 March 1990), after collapsing during game"
Jim Henson,American puppeteer,"See you later, I feel like I'm in good hands.",16 May 1990,to his ex-wife Jane
Leonard Bernstein,American composer and conductor,What is this?,14 October 1990,on receiving an injection
Roald Dahl,British author,"Ow, fuck!",23 November 1990,after a nurse pricked him with a needle
David Reay,captain of Ryan International Airlines Flight 590,"Okay air speed's alive. Engines are stabilized, power's set for departure. Fuel's even kind'a balanced. One hundred knots. V1. Rotate. V2. Plus ten. Positive rate. Watch out. Watch out. Watch out.",17 February 1991,just before plane crashed on takeoff from Cleveland Hopkins International Airport
