name,title,quote,date,context
Lucy Maud Montgomery ,Canadian author,I have lost my mind by spells and I do not dare think what I may do in those spells. May God forgive me and I hope everyone else will forgive me even if they cannot understand. My position is too awful to endure and nobody realizes it. What an end to a life in which I tried always to do my best.,24 April 1942,; conclusion of note found on her bedside table after her death. It may or may not have been a suicide note
José Abad Santos,"fifth Chief Justice of the Philippines, Acting President of the Commonwealth of the Philippines","Take good care of your mother, your brother, and sisters. Tell them to live up to our name. God bless you, my son.",2 May 1942,bidding farewell to his son Pepito prior to execution by occupying Japanese forces. Abad Santos subsequently refused to be blindfolded for his execution and he declined the final cigarette which was offered to him
"(""Smrt fašizmu","sloboda narodu!"") — Stjepan Filipović, Yugoslav communist",Death to fascism! Freedom to the people!,22 May 1942,seconds before execution by hanging
John Barrymore,American actor,"You heard me, Mike.",29 May 1942,"to his brother, Lionel Barrymore, who had failed to understand something he said (Singing ""La Marseillaise"") — Félix Cadras, French lace designer and communist militant (French Communist Party) (30 May 1942), during execution by firing squad"
Maury Henry Biddle Paul,American journalist and society columnist,"Oh Mother, how beautiful it is!",17 July 1942,
Moses Annenberg,American newspaper publisher,"Walter, who knows what is the scheme of things? My suffering has all been for the purpose of making you a man.",20 July 1942,"to his son, Walter Annenberg. Moses Annenberg had been released from prison a month earlier after being convicted of tax evasion"
Adam Czerniaków,"Polish engineer and senator, head of the Warsaw Ghetto Jewish Council (Judenrat)",They demand from me to kill the children of my nation with my own hands. There is nothing left for me but to die.,23 July 1942,"writing to his wife prior to his suicide. The SS had ordered the Judenrat and the Jewish Ghetto Police to begin supplying 6000 people per day, including children, for deportation"
Edward H. Ahrens,United States Marine Raider,The bastards tried to come over me last night – I guess they didn't know I was a Marine.,8 August 1942,found mortally wounded during the Guadalcanal campaign surrounded by 13 dead Japanese soldiers
Edith Stein,German Jewish philosopher and Discalced Carmelite nun,"Come, we are going for our people!",9 August 1942,"to her sister Rosa prior to their deportation to the Auschwitz concentration camp, where they were killed in a mass gas chamber"
Douglas Albert Munro,United States Coast Guardsman and Medal of Honor recipient,Did they get off?,27 September 1942,to his friend Raymond Evans after using his Higgins boat to direct fire away from evacuating American troops
"(""Vande Mataram."") — Matangini Hazra",Indian revolutionary,"I bow to thee, Mother.",29 September 1942,repeatedly chanting words from protest song while being shot by British Indian police at the age of 72
George M. Cohan,American entertainer,Look after Agnes.,5 November 1942,referring to his wife
Alexander Woollcott,American critic and radio personality,I have no need of your Goddamned sympathy – I want to be entertained by some of your grosser reminiscences.,23 January 1943,
Sophie Scholl,"member of White Rose anti-Nazi resistance movement, sister of Hans Scholl","How can we expect righteousness to prevail when there is hardly anyone willing to give himself up individually to a righteous cause... It is such a splendid sunny day, and I have to go. But how many have to die on the battlefield in these days, how many young, promising lives. What does my death matter if by our acts thousands are warned and alerted. Among the student body there will certainly be a revolt.",22 February 1943,before she was taken for beheading by guillotine
"(""Es lebe die Freiheit!"") — Hans Scholl",co-founder of White Rose resistance movement,Long live freedom!,22 February 1943,a moment before he was beheaded by guillotine
Alexander Schmorell,Russian-German student and member of the White Rose resistance movement,Yes.,13 July 1943,on being asked if his name was Alexander Schmorell prior to his execution via guillotine
Radclyffe Hall,English poet and author,What a life!,7 October 1943,
William D. Hawkins,United States Marine Corps officer and Medal of Honor recipient,"Boys, I sure hate to leave you like this.",21 November 1943,mortally wounded at the Battle of Tarawa
Kay Kopl Vesole,United States Navy officer,I've a 3-month-old baby at home. I certainly would like to see my baby.,December 1943,mortally wounded while rescuing survivors from the sinking of SS John Bascom
"(""Post reorganise karo","mein covering fire doonga."") — Abdul Hafiz , Indian recipient of the Victoria Cross","Reorganise the post, I will give covering fire.",6 April 1944,mortally wounded at the Battle of Imphal
George Stinney,African-American child and youngest American with an exact age executed by the United States,No.,16 June 1944,on whether he had any final words before his wrongful execution via electric chair. 14-year-old Stinney was tried and sentenced to death by Judge Philip H. Stoll in under three hours on 14 April after an all-white jury declared him guilty for double murder after only ten minutes of deliberation
William J. O'Brien,United States Army officer and Medal of Honor recipient,Don't give them a damned inch!,7 July 1944,during Banzai charge on his battalion at the Battle of Saipan
Ben L. Salomon,United States Army dental officer and Medal of Honor recipient,I'm going to hold these guys off as long as I can. I'll see you later.,7 July 1944,preparing to cover evacuation of wounded from aid station with M1917 Browning machine gun during the Battle of Saipan
Ludwig Beck,German general,"If it doesn't work this time, then please help me.",20 July 1944,trying unsuccessfully to shoot himself after the failure of the 20 July plot. A soldier then shot and killed him
"(""Es lebe das heilige Deutschland!"") — Claus von Stauffenberg",German army officer,Long live our sacred Germany!,21 July 1944,before being executed by the Nazis for his involvement in the failed 20 July plot
"(""Ben ölürsem","kimseyi suçlamayın; zira açlıktan ölüyorum. Bir sinemada piyano çalarak hayatımı kazanıyordum. Şimdi bu işi de bulamıyorum. Beni bir Müslüman olarak defnedersiniz."") — Şehzade Ahmed Nuri, Ottoman prince","If I die, do not blame anyone because I am starving. I was making a living by playing piano in a movie theater. Now I can not find this job either. You bury me as a Muslim.",7 August 1944,note found in his pocket after he starved to death in a French public park
Joseph P. Kennedy Jr.,United States Navy lieutenant,Spade Flush.,12 August 1944,radioing code phrase prior to explosion of plane on Operation Aphrodite mission
Alexandru Șerbănescu,Second World War Romanian fighter ace,I'm going down...,18 August 1944,crashing after being shot down
"(""Setzen Sie ein Ende","o Gott, für alle unsere Leiden."") — Elisabeth von Thadden, German progressive educator and resistance fighter","Put an end, Lord, to all our sufferings.",8 September 1944,before her execution by the Nazi regime
Winston Ide,Australian rugby union player,"I'm staying here. In any case, I can swim to Australia if I have to.",12 September 1944,responding to requests to save himself during the sinking of the SS Rakuyo Maru
Noor Inayat Khan,", British spy in the Special Operations Executive",Liberté!,13 September 1944,prior to execution by firing squad at Dachau concentration camp
Walter Nowotny,Second World War German fighter ace,I'm on fire.,8 November 1944,crashing due to engine failure after combat with United States Army Air Force planes
Lupe Vélez,"Mexican actress, dancer and singer","To Harald, may God forgive you and forgive me too but I prefer to take my life away and our baby's before I bring him with shame or killing him, Lupe.",14 December 1944,"in her suicide note, addressed to actor Harald Ramond. Vélez was pregnant with Ramond's child at the time"
Norman F. Baesall,U.S. Army Air Force lieutenant colonel,"What's the matter Miller, do you want to live forever?",15 December 1944,in response to Glenn Miller asking where the parachutes were prior to flight from RAF Twinwood Farm to Paris. The plane disappeared while flying over the English Channel
John Basilone,United States Marine Corps Gunnery Sergeant and Medal of Honor recipient,C'mon you guys! Let's get these guns off the beach.,19 February 1945,prior to being killed at the Battle of Iwo Jima
Lena Baker,African American maid,"What I done, I did in self-defense, or I would have been killed myself. Where I was I could not overcome it. God has forgiven me. I have nothing against anyone. I picked cotton for Mr. Pritchett, and he has been good to me. I am ready to go. I am one in the number. I am ready to meet my God. I have a very strong conscience.",5 March 1945,prior to execution by electrocution for the murder of her employer. She received a full and unconditional pardon in 2005
Jack Lummus,"professional football player, United States Marine Corps officer and Medal of Honor recipient","Doc, the New York Giants lost a mighty good end today.",8 March 1945,after losing his legs to a land mine at the Battle of Iwo Jima
Friedrich Fromm,German general,"I die, because it was ordered. I had always wanted only the best for Germany.",12 March 1945,prior to being executed as part of the post-conspiracy purge after the failure of the 20 July plot
Franklin D. Roosevelt,president of the United States,I have a terrific headache.,12 April 1945,before dying of intracerebral hemorrhage
"(""Ik schiet beter!"") — Hannie Schaft",Dutch Resistance Fighter,I shoot better!,17 April 1945,mocking her two executioners after the first shot grazed off her
Ernie Pyle,American war correspondent,Are you all right?,18 April 1945,to Lt. Col. Joseph B. Coolidge before being fatally shot on Iejima during the Battle of Okinawa
"(""Sparami nel petto!"") — Benito Mussolini",Italian fascist statesman,Shoot me in the chest!,28 April 1945,facing a partisan leader
"(""Vor allem verpflichte ich die Führung der Nation und die Gefolgschaft zur peinlichen Einhaltung der Rassegesetze und zum unbarmherzigen Widerstand gegen den Weltvergifter aller Völker","das internationale Judentum."") — Adolf Hitler, German Nazi statesman","Above all, I charge the leadership of the nation and their followers with the strict observance of the racial laws and with merciless resistance against the universal poisoners of all peoples, international Jewry.",30 April 1945,closing his last will before committing joint suicide with his wife Eva
Heinrich Himmler,German Nazi officer,I am Heinrich Himmler.,23 May 1945,last words said during his suicide shortly after biting into a hidden potassium cyanide pill before collapsing dead onto the floor of the headquarters of the Second British Army in Lüneburg
Anton Webern,Austrian composer and conductor,I'm shot...it's over.,15 September 1945,shot by U.S. Army soldier during the Allied occupation of Austria
Béla Bartók,Hungarian composer,I am only sad that I have to leave with a full trunk.,26 September 1945,He died with multiple works left unfinished
Vidkun Quisling,Norwegian politician,I'm convicted unfairly and I die innocent.,24 October 1945,prior to execution by firing squad for murder and high treason
Robert Benchley,American humorist,No. (And supposing you were?),21 November 1945,"; words which he jotted beside the title of an essay which he was reading, ""Am I Thinking?"""
Charles Carroll Taylor,United States Naval Reserve lieutenant,"All planes close up tight ... will have to ditch unless landfall ... when the first plane drops to ten gallons, we all go down together.",5 December 1945,last transmission before Flight 19 disappeared over Bermuda Triangle
"(""Schnell."") — Irma Grese",SS concentration camp guard,Quick.,13 December 1945,prior to her execution by hanging
Maurice Baring,English man of letters,Whatever you would like me to have.,14 December 1945,when asked what he wanted for lunch
John Amery,British fascist,Oh Pierrepoint.,19 December 1945,"; to his executioner, Albert Pierrepoint, prior to hanging for high treason"
George S. Patton,United States Army general,This is a hell of a way to die.,21 December 1945,paralyzed from neck down after automobile collision
Theodore Dreiser,American novelist,"Shakespeare, I come.",28 December 1945,
Gertrude Stein,American writer,"What is the answer? In that case, what is the question?",27 July 1946,addressing her life partner Alice B. Toklas
H. G. Wells,English author and futurist,Go away. I'm all right.,13 August 1946,
Neville Heath,English murderer,You might make that a double.,16 October 1946,when he was offered a drink prior to his execution by hanging
Joachim von Ribbentrop,"German politician, Minister of Foreign Affairs of Nazi Germany",God protect Germany. May I say something else? My last wish is that Germany realize its entity and that an understanding be reached between the East and the West. I wish peace to the world.,16 October 1946,prior to his execution by hanging for war crimes and crimes against humanity (Nuremberg executions)
Wilhelm Keitel,German field marshal,Deutschland über alles!,16 October 1946,during his execution by hanging for war crimes and crimes against humanity (Nuremberg executions)
Ernst Kaltenbrunner,"Austrian SS official, major perpetrator of The Holocaust","I have loved my German people and my fatherland with a warm heart. I have done my duty by the laws of my people and I am sorry my people were led this time by men who were not soldiers and that crimes were committed of which I had no knowledge. Germany, good luck.",16 October 1946,prior to his execution by hanging for war crimes and crimes against humanity (Nuremberg executions)
Alfred Rosenberg,Baltic German Nazi theorist and ideologue,No.,16 October 1946,when asked if he had anything to say prior to his execution by hanging for war crimes and crimes against humanity (Nuremberg executions)
Hans Frank,German politician and lawyer,I am thankful for the kind of treatment during my captivity and I ask God to accept me with mercy.,16 October 1946,prior to his execution by hanging for war crimes and crimes against humanity (Nuremberg executions)
Wilhelm Frick,German politician of the Nazi Party,Long live eternal Germany.,16 October 1946,prior to his execution by hanging for war crimes and crimes against humanity (Nuremberg executions)
"(""Heil Hitler! Dies ist mein Purimfest 1946. Ich gehe zu Gott. Die Bolschewisten werden eines Tages Euch auch hängen!"") — Julius Streicher",,"Heil Hitler, this is my Purim Fest in 1946! I am going to God. The Bolsheviks will hang you one day!","""Heil Hitler! Dies ist mein Purimfest 1946. Ich gehe zu Gott. Die Bolschewisten werden eines Tages Euch auch hängen!""","— Julius Streicher, Nazi politician, founder and publisher of Der Stürmer (16 October 1946), prior to his execution by hanging for crimes against humanity (Nuremberg executions)"
Fritz Sauckel,German Nazi politician,I am dying innocent. The sentence is wrong. God protect Germany and make Germany great again. Long live Germany! God protect my family.,16 October 1946,prior to his execution by hanging for war crimes and crimes against humanity (Nuremberg executions)
Alfred Jodl,German Generaloberst,"My greetings to you, my Germany.",16 October 1946,prior to his execution by hanging for war crimes and crimes against humanity (Nuremberg executions)
Arthur Seyss-Inquart,"Austrian Nazi politician, Reichskommissar of the occupied Netherlands",I hope that this execution is the last act of the tragedy of the Second World War and that the lesson taken from this world war will be that peace and understanding should exist between peoples. I believe in Germany.,16 October 1946,prior to his execution by hanging for war crimes and crimes against humanity (Nuremberg executions)
Damon Runyon,American newspaperman and short-story writer,You can keep the things of bronze and stone and give me one man to remember me just once a year.,10 December 1946,
W. C. Fields,American entertainer,"God damn the whole fuckin' world and everyone in it but you, Carlotta.",25 December 1946,"addressing his mistress, Carlotta Monti"
George Atcheson Jr.,American diplomat,"Well, it can't be helped.",17 August 1947,aboard plane going down in Pacific Ocean near Hawaii
"(""¡Cara de poto!"") — Vicente Huidobro",Chilean poet,You ass-face!,2 January 1948,"; after regaining consciousness, he confessed to his loved ones that he was afraid and made his friend Henriette Petit cry when he stared at her and shouted this expression"
Thomas F. Mantell,Kentucky Air National Guard captain,"The object is directly ahead of and above me now, moving at about half my speed... It appears to be a metallic object or possibly reflection of Sun from a metallic object, and it is of tremendous size... I'm still climbing... I'm trying to close in for a better look.",7 January 1948,during fatal pursuit of UFO
"(""हे राम!"") — Mahatma Gandhi",Indian revolutionary and pacifist,Oh God!,30 January 1948,shortly after being shot by Hindu nationalist Nathuram Godse
Nathanael Edgar,British police officer,The man was by the door. I got his identity card and name. I do not know if it is right. He shot me in the legs with three shots. The pocket book is in my inside pocket.,13 February 1948,describing the circumstances of his being mortally wounded in the line of duty
"(""السيد الأمين العام لجامعة الدول العربية، القاهرة: اني احملكم المسؤولية بعد ان تركتم جنودي في اوج انتصاراتهم بدون عون او سلاح. عبدالقادر الحسيني"") — Abd al-Qadir al-Husayni",Palestinian leader and fighter,"To the General Secretary of the Arab League in Cairo: I lay full blame on your shoulders for leaving my soldiers, in the zenith of victory, without aid or weaponry. Abd al-Qadir al-Husayni.",8 April 1948,in a note to Abdul Rahman Hassan Azzam written shortly before his death during the Battle of Qastal
Babe Ruth,American baseball player,I'm going over the valley.,16 August 1948,
Folke Bernadotte,Swedish nobleman and diplomat,I'll need it.,17 September 1948,on being wished good luck by a journalist prior to his assassination
James Forrestal,United States Secretary of Defense,"Frenzy hath seized thy dearest son, / Who from thy shores in glory came / The first in valor and in fame; / Thy deeds that he hath done / Seem hostile all to hostile eyes.... / Better to die, and sleep / The never waking sleep, than linger on, / And dare to live, when the soul's life is gone.",22 May 1949,"; his suicide note, a quotation from the play Ajax by Sophocles"
Richard Strauss,German composer and conductor,I would give anything just to have written this.,8 September 1949,holding a copy of Mozart's Clarinet Concerto
Lead Belly,"American folk and blues singer, musician and songwriter","Doctor, if I put this here guitar down now, I ain't never gonna wake up.",6 December 1949,"""Mama!"" (""Mamasha!"") — Vaslav Nijinsky, Polish ballet dancer and choreographer (8 April 1950)"
"(""Padám","padám, tento boj jsem prohrála, odcházím čestně. Miluji tuto zem, miluji tento lid, budujte mu blahobyt. Odcházím bez nenávisti k vám. Přeji vám to, přeji vám to…"") — Milada Horáková, Czech politician","I have lost this fight but I leave with honour. I love this country, I love this nation, strive for their wellbeing. I depart without rancour towards you. I wish you, I wish you...",27 June 1950,prior to execution by hanging on fabricated charges of conspiracy and treason
Louis J. Sebille,United States Air Force fighter pilot and Medal of Honor recipient,"No, I'll never make it. I'm going back and get that bastard.",5 August 1950,when urged by one of his wingmen to head for an emergency landing strip after being wounded during the Battle of Pusan Perimeter in the Korean War. Sebille then deliberately crashed into a North Korean convoy
Kenneth Muir ,British Army officer,The Gooks will never drive the Argylls off this hill.,23 September 1950,mortally wounded by automatic weapon fire during Battle of Hill 282 in the Korean War
Al Jolson,American singer and actor,This is it! I'm going. I'm going.,23 October 1950,
George Bernard Shaw,Irish playwright and critic,"Sister, you're trying to keep me alive as an old curiosity, but I'm done, I'm finished, I'm going to die.",2 November 1950,to his nurse
Jesse L. Brown,United States Naval Aviator,Tell Daisy that I love her.,4 December 1950,mentioning his wife while trapped and dying in cockpit after being shot down during the Battle of Chosin Reservoir in the Korean War. Thomas J. Hudner Jr. received the Medal of Honor for his unsuccessful attempt to rescue Brown
John U. D. Page,United States Army officer and Medal of Honor recipient,Get back ... I'll cover you.,11 December 1950,prior to being killed in action during the Battle of Chosin Reservoir in the Korean War
Ray Wetmore,American World War II flying ace,Say goodbye to my wife and kids.,14 February 1951,prior to fatal crash of F-86 Sabre
"(""C'est bien."") — André Gide",French author,It is well.,19 February 1951,
Martha Beck,American serial killer,So long.,8 March 1951,whispering while being placed in the electric chair
Ludwig Wittgenstein,Austrian philosopher,Tell them I've had a wonderful life.,29 April 1951,upon being told that his close friends would come to visit him the next day
Emil Kapaun,United States Army Roman Catholic chaplain and Medal of Honor recipient,"As you see, I am crying too, not tears of pain but tears of joy, because I'll be with my God in a short time.",23 May 1951,dying in prisoner of war camp during the Korean War
Arnold Schoenberg,Austrian-American composer,Harmony.,13 July 1951,
Anthony T. Kahoʻohanohano,United States Army soldier and Medal of Honor recipient,I've got your back.,1 September 1951,prior to being killed in action in the Korean War
Joseph Vittori,United States Marine and Medal of Honor recipient,You go. I'll cover you.,16 September 1951,prior to being killed in action at the Battle of the Punchbowl in the Korean War
Owen Roberts,British Royal Air Force officer and aviator,"If they are not, blame me.",10 April 1953,when his flight attendant question the safeness of the Lockheed Lodestar prior to the aircraft he piloted crashed during takeoff
Hilaire Belloc,French-English author and Member of Parliament,This must be an awful bore for you.,16 July 1953,after being given a blanket and propped up with a pillow by his daughter and grandson
Maude Adams,American actress known for playing Peter Pan,Life is still full of joy. Thumbs up for joy and adventure.,17 July 1953,
Kathleen Ferrier,English contralto singer,Wouldn't it be lovely if I could just go to sleep and not wake up again?,8 October 1953,to a nurse while dying of breast cancer
Eugene O'Neill,American playwright,"I knew it! I knew it! Born in a hotel room and, goddamn it, dying in a hotel room.",27 November 1953,to his wife Carlotta Monterey
Johnny Ace,American rhythm-and-blues singer and musician,I'll show you that it won't shoot.,25 December 1954,playing with a .32 caliber revolver
"(""Docteur","pensez-vous que cela aurait pu être la saucisse?"") — Paul Claudel, French writer and diplomat","Doctor, do you think it could have been the sausage?",23 February 1955,
Albert Einstein,German physicist,"I want to go when I want. It is tasteless to prolong life artificially. I have done my share, it is time to go. I will do it elegantly.",18 April 1955,declining surgery the day before his death
Mary McLeod Bethune,"American educator, stateswoman and civil rights activist",Life is wonderful. I am wonderful.,18 May 1955,
James Dean,American actor,That guy's gotta stop... He'll see us.,30 September 1955,"to his friend Rolf Wütherich, moments before the car crash"
Alexandrina of Balazar (born Alexandrina Maria da Costa),"Portuguese Roman Catholic mystic, victim soul and blessed","I am happy, because I am going to Heaven.",13 October 1955,
"(""おいしい."") – Sadako Sasaki",Japanese 12-year-old victim of the United States' atomic bombings of Hiroshima and Nagasaki known for folding a thousand paper cranes,It's tasty.,25 October 1955,"to her family after tasting her final meal, tea on rice"
Alben W. Barkley,vice-president of the United States,"I am wiling to be a junior. I am glad to sit in the back row, for I had rather be a servant in the house of the Lord than to sit in the seats of the mighty.",30 April 1956,alluding to Psalms 84:10 just before dying of a heart attack while giving keynote address at the 1956 Washington and Lee Mock Convention
Max Beerbohm,"English essayist, parodist and caricaturist",No. Thanks for everything.,20 May 1956,on being asked by his wife if he had had a good sleep
Walter de la Mare,English author,"Too late for fruit, too soon for flowers.",22 June 1956,when asked if he wanted some fruit or flowers
Tom Gastall,American baseball player,75-Hotel. I'm going into the water.,20 September 1956,final radio transmission before crash of his ERCO Ercoupe into Chesapeake Bay
Milburn G. Apt,American test pilot,There she goes!,27 September 1956,final radio transmission while losing control of Bell X-2
Humphrey Bogart,American actor,"Goodbye, kid. Hurry back.",14 January 1957,"to his wife Lauren as she left to collect their children, after which he entered a fatal coma"
