name,title,quote,date,context
Erskine Childers,English-born Irish writer,"Take a step or two closer, lads. It will be easier that way.",24 November 1922,facing a firing squad
Katherine Mansfield,New Zealand modernist writer,I believe... I'm going to die. I love the rain. I want the feeling of it on my face.,9 January 1923,
Sarah Bernhardt,French actress,How slow my death agony is.,26 March 1923,
William Robertson Nicoll,Scottish minister and writer,I believe everything I have written about immortality.,4 May 1923,
W. P. Ker,Scottish literary scholar,"I thought this was the most beautiful spot in the world, and now I know it.",17 July 1923,to his hiking companions on the Pizzo Bianco before suffering a heart attack
Warren G. Harding,president of the United States,"That's good. Go on, read some more.",2 August 1923,"to his wife, Florence Harding, who had been reading aloud a flattering Saturday Evening Post article about him"
"(""хорошая собака."") — Vladimir Lenin",Russian communist statesman and revolutionary,Good dog.,21 January 1924,to his dog who brought him a dead bird
Woodrow Wilson,president of the United States,When the machinery is broken... I am ready.,3 February 1924,
Eleonora Duse,Italian actress,"We must stir ourselves. Move on! Work, work! Cover me! Must move on! Must work! Cover me!",21 April 1924,
"(""Töten Sie mich","sonst sind Sie ein Mörder!"") — Franz Kafka, German-speaking Bohemian novelist and short-story writer","Kill me, or else you are a murderer!",3 June 1924,asking his doctors for morphine overdose while dying of tuberculosis
Ferruccio Busoni,Italian composer,"Dear Gerda, I thank you for every day we have been together.",27 July 1924,to his wife
Anatole France,French writer and journalist,So this is what it is like to die – it takes a long time!,12 October 1924,
Floyd Collins,American cave explorer,You're too slow...too slow.,c. 13 February 1925,"to rescue workers trying to free him from his entrapment in Sand Cave, Kentucky"
Erik Satie,French composer and pianist,"Ah, the cows...",1 July 1925,
"(""До свиданья","друг мой, до свиданья. / Милый мой, ты у меня в груди. / Предназначенное расставанье / Обещает встречу впереди."") — Sergei Yesenin, Russian lyric poet","Goodbye, my friend, goodbye. My dear, you are in my heart. Predestined separation promises a future meeting.",28 December 1925,in his final poem before allegedly taking his own life
Zip the Pinhead,American freak show performer,"Well, we fooled 'em for a long time, didn't we?",9 April 1926,
Luther Burbank,American botanist,I don't feel good.,11 April 1926,
Rudolph Valentino,Italian actor,Don't pull down the blinds. I want the sunlight to greet me.,23 August 1926,to a nurse
Rainer Maria Rilke,Bohemian-Austrian poet and novelist,I don't want the doctor's death. I want to have my own freedom.,29 December 1926,
Lala ,Indian World War I Victoria Cross recipient,We fought true.,23 March 1927,dying of polio
Reginald Dyer,British Indian Army officer,So many people who knew the condition of Amritsar say I did right...but so many others say I did wrong. I only want to die and know from my Maker whether I did right or wrong.,23 July 1927,"In 1919, Dyer ordered the troops under his command to fire into a crowd of protesting Indian independence activists in Jallianwala Bagh, Punjab, killing at least 379 people and wounding over 1,200 others"
Ryūnosuke Akutagawa,Japanese writer,"Probably no one who attempts suicide—is fully aware of all his motives, which are usually too complex. At least in my case it is prompted by a vague sense of anxiety—about my own future. — As for my vague sense of anxiety about my own future, I think I analyzed it all in 'A Fool's Life,' except for a social factor, namely the shadow of feudalism cast over my life. This I omitted purposely, not at all certain that I could really clarify the social context in which I lived. — P.S. Reading a life of Empedocles, I felt how old is this desire to make a god of oneself. This letter, so far as I am conscious, never attempts this. On the contrary, I consider myself one of the most common humans. You may recall those days of twenty years ago when we discussed 'Empedocles on Etna'—under the linden trees. In those days I was one who wished to make a god of myself.",24 July 1927,; excerpt from his suicide note
Nicola Sacco,Italian immigrant anarchist,"Farewell, mother!",23 August 1927,prior to execution by electrocution
Bartolomeo Vanzetti,Italian immigrant anarchist,I wish to forgive some people for what they are now doing to me.,23 August 1927,prior to execution by electrocution
"(""Adieu","mes amis. Je vais à la gloire!"") — Isadora Duncan, American/French dancer","Farewell, my friends. I go to glory!",14 September 1927,just before dying in freak car accident
Hawthorne C. Gray,American aeronaut,"Sky deep blue, sun very bright, sand [buoyancy compensator] all gone.",4 November 1927,final journal entry during balloon altitude record attempt
"(""¡Viva Cristo Rey!"") — Miguel Pro",Mexican Jesuit Catholic priest,Long live Christ the King!,23 November 1927,prior to execution by firing squad on false charges of sedition
Brian Oswald Donn-Byrne,Irish novelist,I think I'll go for a drive before dinner – anyone coming?,18 June 1928,prior to dying in auto accident
George Appel,American murderer,"Well folks, you'll soon see a baked apple.",9 August 1928,prior to execution by electrocution
Clarence W. Barron,American newsman and de facto manager of The Wall Street Journal,What is the news?,2 October 1928,
Arnold Rothstein,American mobster,Me mudder did it.,6 November 1928,when asked who had fatally shot him
Henry Arthur Jones,English dramatist,The prettier. Now fight for it.,7 January 1929,when his nurse and his niece asked which of them he would prefer to stay with him
Habibullāh Kalakāni,claimant of the titles of King and Emir of Afghanistan,"I have nothing to ask God, he has given me everything I desired. God has made me King.",1 November 1929,"prior to execution""Dictionary."" — Joseph Wright, compiler of The English Dialect Dictionary (27 February 1930)"
D. H. Lawrence,English writer and poet,I think it is time for morphine.,2 March 1930,
Henry Segrave,British land speed and water speed record pioneer,How are the lads? Did we do it?,13 June 1930,"mortally injured in crash of Miss England II. He was asking his wife about the fates of his chief engineer (who was killed) and his mechanic (who survived), and whether they had broken the water speed record (they had)"
Arthur Conan Doyle,"British physician, author and spiritualist",You are wonderful.,7 July 1930,spoken to his wife in their garden; he proceeded to clutch his chest and die
Carl Panzram,American serial killer and rapist,"Hurry it up, you Hoosier bastard! I could hang a dozen men while you're fooling around!",5 September 1930,spitting in his executioner's face prior to hanging
"(""Приготовьте мой костюм лебедя!"") — Anna Pavlova","Russian prima ballerina, creator of the role of The Dying Swan",Get my Swan costume ready.,23 January 1931,
"(""ਇੰਕਿਲਮ ਜ਼ਿੰਦਾਬਾਦ!"") — Bhagat Singh","Indian revolutionary and Socialist, founder of Hindustan Socialist republican association",Long live Revolution,23 March 1931,
Arnold Bennett,English writer,"Everything's gone wrong, my girl.",27 March 1931,"to his mistress, Dorothy Cheston"
Albert A. Michelson,American physicist,"The following is a report on the measurement of the velocity of light made at the Irvine Ranch, near Santa Ana, California, during the period of September 1929 to—.",9 May 1931,writing in a scientific log
Raymond Hamilton,member of Barrow Gang,"Well, goodbye all",10 May 1935,before dying in the electric chair
Eugène Ysaÿe (12 May 1931),,Splendid. The finale just a little too fast.,12 May 1931,"Belgian violinist, composer and conductor, after his Fourth Sonata was played for him"
David Belasco,American playwright and theater impresario,"Doctor, I'm fighting for my life!",14 May 1931,
Peter Kürten,"German serial killer known as ""The Vampire of Düsseldorf""","After my head is chopped off, will I still be able to hear, at least for a moment, the sound of my own blood gushing from the stump of my neck? That would be the pleasure to end all pleasures.",2 July 1931,prior to execution by guillotine
"(""Wiedersehen...Gruss..."") — Paul Anlauf",German police captain,So long...Goodbye...,9 August 1931,assassinated by members of the Communist Party of Germany including Erich Mielke
Thomas Edison,American inventor,It's very beautiful over there.,18 October 1931,speaking words of unclear meaning as he was dying
Vachel Lindsay,American poet,They tried to get me — I got them first!,5 December 1931,in his suicide note
Francis Crowley,American murderer,You sons of bitches. Give my love to Mother.,21 January 1932,prior to execution by electrocution
Lytton Strachey,English writer and critic,"If this is dying, then I don't think much of it.",21 January 1932,
George Eastman,American entrepreneur,To my friends / My work is done / Why wait? / G.E.,14 March 1932,"as his suicide note, before shooting himself in the chest"
Hart Crane,American poet,"Goodbye, everybody!",27 April 1932,"prior to jumping off a cruise ship ″Well, wait, you’ll understand once we talk. It's day, you need not shoot me.″ (""まあ、待て、話をすればわかるだろう。撃たんでもええ、、"") - Tsuyoshi Inukai, former Prime Minister of Japan (15 May 1932), assassinated by Taku Mikami"
Florenz Ziegfeld Jr.,American Broadway impresario,Curtain! Fast music! Lights! Ready for the last finale! Great! The show looks good. The show looks good.,22 July 1932,
Zhang Zongchang,"Chinese warlord, after being shot by an assassin",No good!,3 September 1932,
Calvin Coolidge,president of the United States,"Good morning, Robert.",5 January 1933,to a carpenter working on his house
Alva Belmont,American socialite and women's suffrage activist,"The important thing is knowing how to live. Learn a lesson from my mistakes. I had too much power before I knew how to use it and it defeated me in the end. It drove all sweetness out of my life except the affection of my children. My trouble was I was born too late for the last generation and too early for this one. If you want to be happy, live in your own time.",26 January 1933,
Anton Cermak,Mayor of Chicago,Take that tent thing off me and give me something to drink. Quit shooting that stuff into my arm and leave me alone. I'm going to get well.,6 March 1933,in hospital after being wounded in assassination attempt on Franklin D. Roosevelt; last reported words
Wilson Mizner,American playwright and entrepreneur,Why should I talk to you? I've just been talking to your boss.,3 April 1933,to a priest at his deathbed
Bill Lancaster,Australian aviator,So the beginning of the eighth day has dawned. It is still cool. I have no water....I am waiting patiently. Come soon please. Fever wracked me last night. Hope you get my full log. Bill.,20 April 1933,final note written on fuel card while dying after crash in Sahara Desert
Jack Holland,American college football player and boxer,I butted him.,9 May 1933,while leaving ring after loss to Tony Marullo; he then collapsed from a cerebral hemorrhage
Richard B. Mellon,"American banker, industrialist and philanthropist",Last tag.,1 December 1933,to his brother Andrew Mellon; the two had been engaged in a playful game of tag for some seventy years
Albert I of Belgium (17 February 1934),,Follow the path for another fifty yards. I am going back to the foot of the rocks to make another climb. If I feel in good form I shall take the difficult way up; if I do not I shall take the easy one. I shall join you in an hour.,17 February 1934,shortly before falling to his death while rock climbing
"(""Ella","Ella! Kõik on täiesti teisiti!"") — Ernst Enno, Estonian writer","Ella, Ella! Everything is utterly different!",7 March 1934,to his wife
"(""Je ne le veux pas."") — Marie Skłodowska Curie",Polish scientist,I don't want it.,4 July 1934,upon being offered a painkilling injection
Winsor McCay,American cartoonist and animator,"It's gone, mother! Gone, gone, gone!",26 July 1934,to his wife after he found that his right arm was paralyzed
Alexander I of Yugoslavia (9 October 1934),,Save Yugoslavia. Take good care of the queen.,9 October 1934,"assassinated in Marseille, France, by Bulgarian nationalist Vlado Chernozemski"
Louis Barthou,French Minister of Foreign Affairs,I suffer terribly. I am thirsty.,9 October 1934,killed by police gunfire during the response to Alexander's assassination
Clyde Smith,Australian rules footballer and police constable,What happened? It got me in the thigh.,5 January 1935,accidentally shot by police colleague
Ma Barker,American mother of criminals,All right! Go ahead!,16 January 1935,"to her son, Fred Barker, prior to their deaths in a shootout with the FBI"
Jane Addams,"American settlement and temperance activist, social worker and author","Always, always. Water for me.",21 May 1935,when her physician asked if she wanted some water
Will Rogers,"American stage and film actor, vaudeville performer, cowboy, humorist, newspaper columnist, and social commentator",Death.,15 August 1935,typed on his typewriter for an unfinished newspaper column prior to the plane crash that killed him and Wiley Post
Charlotte Perkins Gilman,American humanist and writer,"When all usefulness is over, when one is assured of an unavoidable and imminent death, it is the simplest of human rights to choose a quick and easy death in place of a slow and horrible one.",17 August 1935,in her suicide note
Henri Barbusse,French novelist and Communist,"Telephone and say that they must still enlarge it–Always larger, broader, more universal–It's the only means of saving the world.",30 August 1935,referring to the Second Italo-Ethiopian War
Huey Long,United States Senator,I wonder why he shot me.,10 September 1935,after being fatally shot
Dutch Schultz,American mobster,"The Baron says these things. I know what I am doing here with my collection of papers. It isn't worth a nickel to two guys like you or me but to a collector it is worth a fortune. It is priceless. I am going to turn it over to... Turn your back to me, please Henry. I am so sick now. The police are getting many complaints. Look out. I want that G-note. Look out for Jimmy Valentine for he is an old pal of mine. Come on, come on, Jim. Ok, ok, I am all through. Can't do another thing. Look out mamma, look out for her. You can't beat him. Police, mamma, Helen, mother, please take me out. I will settle the indictment. Come on, open the soap duckets. The chimney sweeps. Talk to the sword. Shut up, you got a big mouth! Please help me up, Henry. Max, come over here. French-Canadian bean soup. I want to pay. Let them leave me alone.",24 October 1935,speaking in stream-of-consciousness babble after being shot
"(""Dá-me os óculos."") – Fernando Pessoa",Portuguese poet,Give me the glasses.,30 November 1935,to the nurse who treated him
Alban Berg,Austrian composer,But I have so little time.,24 December 1935,"to his wife, who had asked him to relax"
Albert Fish,"American serial killer, child rapist and cannibal","What a thrill it will be to die in the electric chair... the supreme thrill, the only one I haven't tried.",16 January 1936,prior to execution by electrocution
George V,king of the United Kingdom,God damn you!,20 January 1936,"to a nurse giving him a sedative. The King was euthanized on the orders of his doctor, Bertrand Dawson, 1st Viscount Dawson of Penn"
Richard A. Loeb,American murderer,I think I'm going to make it.,28 January 1936,after being slashed 56 times with a razor in a prison fight
A. E. Housman,English classical scholar and poet,Indeed – very good. I shall – have to repeat – that – on the Golden Floor.,30 April 1936,"to his doctor, who had just told a risqué joke"
Robert E. Howard,American author and creator of Conan the Barbarian,"All fled, all done, so lift me on the pyre. The feast is over, and the lamps expire.",11 June 1936,"; his suicide note, a quotation from ""The House of Cæsar"" by Viola Garvin"
G. K. Chesterton,"English writer, philosopher, lay theologian and critic","The issue is now clear. It is between light and darkness, and everyone must choose his side.",14 June 1936,
"(""Ich kann nicht mehr."") — Toni Kurz",German mountain climber,I cannot go on.,22 July 1936,dying on the Eiger north face
Pedro Muñoz Seca,Spanish comic playwright,I am starting to believe you are not intending to count me among your friends!,28 November 1936,to his firing squad during the Paracuellos massacres
Luigi Pirandello,Italian playwright,"The hearse, the horse, the driver and—enough!",10 December 1936,
André Bessette,"C.S.C., Canadian Roman Catholic lay brother","My God, how it hurts! Oh I suffer!",6 January 1937,
Alfred Adler,Austrian psychotherapist,Kurt.,28 May 1937,mumbling his son's name after collapsing on the street
J. M. Barrie,Scottish novelist and playwright,I can't sleep.,19 June 1937,
Amelia Earhart,American aviation pioneer,We are running on line north and south.,c. 2 July 1937,reporting to her headquarters in her last known radio transmission shortly before her disappearance
Bessie Smith,American blues singer,"I'm going, but I'm going in the name of the Lord.",26 September 1937,
Violette Neatley Anderson,first African-American woman to practice law before the United States Supreme Court,Tell the girls to keep on going ahead. Put over the boule with a bang. Don't let my passing throw the slightest shadow of gloom. The organization has a grand mission before it.,24 December 1937,; speaking to Claude Albert Barnett while dying of cancer prior to Zeta Phi Beta's annual boule
Maurice Ravel,French composer,I look like a Moor.,28 December 1937,referring to the bandages on his head after brain surgery
O. O. McIntyre,American newspaper columnist,"Snooks, will you please turn this way? I like to look at your face.",14 February 1938,to his wife
Gabriele D'Annunzio,Italian author and soldier,Stop—I turn home... I'm bored... I'm bored.,1 March 1938,to his chauffeur
Egon Friedell,Austrian polymath,"Watch out, please.",16 March 1938,before jumping out a window to avoid capture by Gestapo
Alfonso,"Prince of Asturias, former heir apparent to the throne of Spain","¡Mi madre! ¡Mi madre! Where is my mother? I'm all alone in this country. Don't leave me, Jack.",6 September 1938,"dying of internal bleeding after car accident in Miami, Florida"
"(""Aleykümesselam."") — Mustafa Kemal Atatürk",President of Turkey,Peace be upon you.,10 November 1938,
"(""Ich bin krank – ich habe Fieber..."") — Paul Morgan",Austrian actor and cabaret performer,I am sick – I have a fever...,10 December 1938,said prior to collapsing and dying of exhaustion in Buchenwald concentration camp
Valery Chkalov,Soviet test pilot,Do not blame anyone. It's my fault.,15 December 1938,fatally injured in crash of Polikarpov I-180 fighter prototype
Arthur Barker,American criminal,I'm all shot to hell!,13 January 1939,shot while attempting to escape from Alcatraz Federal Penitentiary
W. B. Yeats,Irish poet and dramatist,"You can refute Hegel, but not the Saint or the Song of Sixpence.",28 January 1939,
Nicholas Comper,English aviator and aircraft designer,I didn't know prisons had such comfortable beds.,17 June 1939,"dying in hospital after being knocked down while lighting a firework in Hythe, Kent, by a passer-by to whom he claimed he was an IRA man planning to blow up the town hall"
Richard Seaman,British racing driver,I was going too fast for the conditions – it was entirely my own fault – I am sorry.,25 June 1939,on his deathbed after being fatally burned in a racing crash
Sigmund Freud,"Austrian neurologist, founder of psychoanalysis",The meager satisfaction that man can extract from reality leaves him starving.,23 September 1939,
Douglas Fairbanks,American actor and filmmaker,Never felt better.,12 December 1939,"to an attendant who asked how he was""I am only asking for one thing—let me finish my work."" — Isaac Babel, Russian author (27 January 1940), prior to execution by firing squad on fabricated charges of terrorism and espionage"
Leon Trotsky,Soviet revolutionary,I feel this time they have succeeded. I do not want them to undress me. I want you to undress me.,21 August 1940,"to his wife, Natalia Sedova, while being prepared for surgery after being mortally wounded by assassin Ramón Mercader"
"(""Per Catalunya!"") — Lluís Companys",President of the Government of Catalonia,For Catalonia!,15 October 1940,prior to execution by firing squad
John Dundas,Second World War British fighter ace,I've finished a 109—Whoopee!,28 November 1940,prior to being shot down and killed
F. Scott Fitzgerald,American novelist,Hershey bars will be good enough – they'll be fine.,21 December 1940,to Sheilah Graham
James Joyce,"Irish novelist, author of Ulysses and Finnegans Wake",Does nobody understand?,13 January 1941,
Richhpal Ram ,Indian recipient of the Victoria Cross,We'll capture the objective.,12 February 1941,"mortally wounded at Keren, Eritrea"
Alfonso XIII,former King of Spain,"Spain, My God!",28 February 1941,kissing a crucifix
Virginia Woolf,English writer,I don't think two people could have been happier than we have been.,28 March 1941,"addressing her husband Leonard in her suicide note, drowning herself later that day"
"(""Es geht mit mir zu Ende","ich versinke, ich versinke!"") — Wilhelm II, the last German Emperor","It's coming to an end for me, I'm sinking, I'm sinking!",4 June 1941,dying of a pulmonary embolism at Huis Doorn
Cecil Pugh,"GC, MA, Congregational Church minister",My love of God is greater than my fear of death.,5 July 1941,"asking to be lowered into the hold of the sinking SS Anselm, where injured airmen were trapped. Pugh then prayed with the men until the ship sank"
Maximilian Kolbe,"Polish Catholic priest, promoter of veneration of the Immaculate Virgin Mary","Love the immaculate, love the immaculate, love the immaculate.",14 August 1941,injected with carbolic acid after two weeks of starvation in Auschwitz concentration camp. He had offered himself for starvation in the place of an inmate with a family
Karl Gravell,", Royal Canadian Air Force Leading Aircraftman",Did I get Jimmy out?,10 November 1941,after unsuccessful attempt to rescue Flying Officer James Robinson from wreckage of crashed Tiger Moth
"(""Прощайте товарищи! Боритесь","не бойтесь! Сталин с нами! Сталин придёт!"") — Zoya Kosmodemyanskaya, Soviet partisan","Farewell, comrades! Fight, do not be afraid! Stalin is with us! Stalin will come!",29 November 1941,prior to her execution by Germans in Petrishchevo for arson in there
Herbert C. Jones,United States Navy officer and Medal of Honor recipient,Leave me alone! I am done for. Get out of here before the magazines go off.,7 December 1941,mortally wounded aboard USS California (BB-44) during the attack on Pearl Harbor
Robert R. Scott,United States Navy sailor and Medal of Honor recipient,"As long as I can give these people air, I'm sticking.",7 December 1941,refusing to evacuate flooded air compressor compartment aboard USS California (BB-44) during the attack on Pearl Harbor
Simon Dubnow,"Jewish-born Russian historian, writer and activist","If you survive, never forget what is happening here, give evidence, write and rewrite, keep alive each word and each gesture, each cry and each tear!",8 December 1941,prior to his murder in the Riga ghetto at the time of the Rumbula massacre
John K. Lawson,Canadian Army officer,Going outside to fight it out.,19 December 1941,over the radio to his commanders prior to leaving his headquarters building during the Battle of Hong Kong
"(""Verzeihen Sie","dass wir Ihnen über den Tod hinaus noch Mühe verursachen; ich bin überzeugt, dass Sie tun, was Sie tun können (und was vielleicht nicht sehr viel ist). Verzeihen Sie uns auch unsere Desertion! Wir wünschen Ihnen und allen unseren Freunden, noch bessere Zeiten zu erleben. Ihr treu ergebener Felix Hausdorff"") — Felix Hausdorff, German mathematician","I am sorry that we cause you yet more effort beyond death, and I am convinced that you are doing what you can do (which perhaps is not very much). Forgive us our desertion! We wish you and all our friends to experience better times. Your truly devoted Felix Hausdorff",26 January 1942,"; the conclusion of his suicide letter to his lawyer. Hausdorff, his wife and his sister-in-law committed suicide rather than be deported to the Endenich camp"
Walter Brown,", Australian World War I recipient of the Victoria Cross",No surrender for me.,15 February 1942,before walking toward Japanese lines carrying grenades during the Battle of Singapore
Olena Teliha,Ukrainian poet and activist,Here Olena Teliha was sitting until she was shot.,21 February 1942,; inscription written on the wall of her prison cell prior to her execution by the Gestapo
Stefan Zweig,Austrian writer,I think it better to conclude in good time and in erect bearing a life in which intellectual labour meant the purest joy and personal freedom the highest good on Earth.,22 February 1942,"in his last testament before committing suicide with his wife, Lotte Altmann"
